Size Category,Est. Enrollment,University,# Contacts,Contact Names,Contact Emails
"Medium (10,000–19,999)",12000,Middle Georgia State University – Online,6,Scott Bass | Department of Management & Finance | Employer Relations Team | Experiential Learning | Office of Student Life,scott.bass@mga.edu | management.finance@mga.edu | employerrelations@mga.edu | experientiallearning@mga.edu | studentlife@mga.edu
"Medium (10,000–19,999)",12000,Midwestern State University (Wichita Falls),8,"Scott D. White, PhD | Dillard College of Business Administration Office | Department of Accounting, Finance & MIS | Career Development Center | Employer Relations",scott.white@msutexas.edu | business@msutexas.edu | accounting@msutexas.edu | careerdevelopment@msutexas.edu | employerrelations@msutexas.edu
"Medium (10,000–19,999)",12000,Mississippi Valley State University – Greenwood Center,8,Greenwood Center Administration | College of Business Office | Department of Business Administration | Career Services Office | Employer Relations,greenwoodcenter@mvsu.edu | business@mvsu.edu | busadmin@mvsu.edu | careerservices@mvsu.edu | employerrelations@mvsu.edu
"Medium (10,000–19,999)",12000,New Jersey Institute of Technology,7,Martin Tuchman School of Management | Department of Finance & Financial Systems | Office of Student Life | Career Development Services | Office of Experiential Learning,som@njit.edu | finance@njit.edu | studentlife@njit.edu | cds@njit.edu | experientiallearning@njit.edu
"Medium (10,000–19,999)",12000,New Mexico State University – Global Campus,7,College of Business – Department Office | Center for Real Estate (College of Business) | Global Campus Student Engagement | Career Services | Experiential Learning Office,business@nmsu.edu | cre@nmsu.edu | globalcampus@nmsu.edu | careerservices@nmsu.edu | experientiallearning@nmsu.edu
"Medium (10,000–19,999)",12000,Nicholls State University – Continuing Education,5,Continuing Education Office | Career Services Office | College of Business Administration Office | Office of Student Affairs | Experiential Learning / Internships,conted@nicholls.edu | careers@nicholls.edu | cobadmin@nicholls.edu | studentaffairs@nicholls.edu | internships@nicholls.edu
"Medium (10,000–19,999)",12000,North Carolina State University – Poole Executive Education,7,Poole College of Management – Executive Education | Poole College of Management Dean’s Office | Department of Business Management | Department of Economics | Career Development Center (Poole),poole_execed@ncsu.edu | poole_dean@ncsu.edu | business_management@ncsu.edu | economics@ncsu.edu | poole_career@ncsu.edu
"Medium (10,000–19,999)",12000,Oklahoma Panhandle State University,6,Department of Business Administration | Accounting & Finance Program | Career Services | Experiential Learning & Internships | Office of Student Affairs,business@opsu.edu | business@opsu.edu | careers@opsu.edu | careers@opsu.edu | studentaffairs@opsu.edu
"Medium (10,000–19,999)",12000,Oklahoma State University Institute of Technology,6,"School of Arts, Sciences & Health | Applied Technology Division | Career Services | Experiential Learning & Internships | Student Life Office",artsciences@osuit.edu | appliedtech@osuit.edu | careers@osuit.edu | careers@osuit.edu | studentlife@osuit.edu
"Medium (10,000–19,999)",12000,Pennsylvania State University – World Campus,7,Penn State World Campus | Smeal College of Business | Department of Finance | College of Earth & Mineral Sciences | Career Services,worldcampus@psu.edu | smeal@psu.edu | finance@psu.edu | ems@psu.edu | careers@psu.edu
"Medium (10,000–19,999)",12000,San José State University – Moss Landing Center,7,Lucas College & Graduate School of Business – Dean’s Office | Department of Finance | College of Social Sciences – Environmental Studies & Urban Planning (routing) | Career Center | Employer Relations,lucasgsb@sjsu.edu | finance@sjsu.edu | socialsciences@sjsu.edu | careerhelp@sjsu.edu | employerrelations@sjsu.edu
"Medium (10,000–19,999)",12000,Savannah State University at Liberty Center,7,College of Business Administration – Dean’s Office | Department of Business Administration | Liberty Center Administration | Career Services | Employer Relations,cob@savannahstate.edu | business@savannahstate.edu | libertycenter@savannahstate.edu | careers@savannahstate.edu | employerrelations@savannahstate.edu
"Medium (10,000–19,999)",12000,Shawnee State University,7,College of Business – Dean’s Office | Department of Accounting & Business Administration | Office of Student Involvement | Career Services | Employer Relations,business@shawnee.edu | businessadmin@shawnee.edu | involvement@shawnee.edu | careers@shawnee.edu | employerrelations@shawnee.edu
"Medium (10,000–19,999)",12000,Southern Illinois University – Online,7,College of Business and Analytics – Dean’s Office | Department of Finance | Office of Student Involvement | Career Development Center | Employer Relations,coba@siu.edu | finance@siu.edu | studentinvolvement@siu.edu | careers@siu.edu | employerrelations@siu.edu
"Medium (10,000–19,999)",12000,Sul Ross State University Rio Grande College,5,College of Business Administration | Dr. Sandra Fuentes | Career Services | Office of Student Life | Admissions Office,coba@sulross.edu | sfuentes@sulross.edu | careers@sulross.edu | studentlife@sulross.edu | admissions@sulross.edu
"Medium (10,000–19,999)",12000,Tarleton State University – Fort Worth,6,Dr. Kendra Ketcherside | Dr. David Carstens | Dr. Yaw Frimpong | Career Services | Student Engagement & Success,kketcherside@tarleton.edu | dcarstens@tarleton.edu | yfrimpong@tarleton.edu | careers@tarleton.edu | studentengagement@tarleton.edu
"Medium (10,000–19,999)",12000,Tarleton State University – Online,6,Dr. Kendra Ketcherside | Dr. David Carstens | College of Business Administration Office | Career Services | Extended Education & Online Programs,kketcherside@tarleton.edu | dcarstens@tarleton.edu | business@tarleton.edu | careers@tarleton.edu | extendeded@tarleton.edu
"Medium (10,000–19,999)",12000,Texas State University – San Marcos Campus,3,Dr. Sanjay Ramchander | Student Involvement | Admissions Office,dean@mccoy.txstate.edu | studentinvolvement@txstate.edu | admissions@txstate.edu
"Medium (10,000–19,999)",12000,Texas State University Round Rock Campus,3,Round Rock Campus Administration | Student Involvement | Admissions Office,rrcampus@txstate.edu | studentinvolvement@txstate.edu | admissions@txstate.edu
"Medium (10,000–19,999)",12000,Vermont State University,6,Dr. Michael McDonough | business@vermontstate.edu | Dr. Nancy Stetson | careerservices@vermontstate.edu | employerrelations@vermontstate.edu,michael.mcdonough@vermontstate.edu | business@vermontstate.edu | nancy.stetson@vermontstate.edu | careerservices@vermontstate.edu | employerrelations@vermontstate.edu
"Medium (10,000–19,999)",12000,Vermont State University – Castleton,5,School of Business | Dr. Donald J. Russell | Career Services | Student Affairs | Admissions Office,business@castleton.edu | drussell@castleton.edu | careerservices@castleton.edu | studentaffairs@castleton.edu | admissions@castleton.edu
"Medium (10,000–19,999)",12000,Washington State University – Global Campus,5,Carson College of Business | Dr. S. Keith Knudsen | WSU Global Campus | Career Services | Admissions Office,business@wsu.edu | keith.knudsen@wsu.edu | global@wsu.edu | career@wsu.edu | admissions@wsu.edu
"Medium (10,000–19,999)",12000,Fitchburg State University,8,"Business Administration Department | Economics, History & Political Science | Academic Affairs | Career Services & Advising Center | Student Development",business@fitchburgstate.edu | ehps@fitchburgstate.edu | provost@fitchburgstate.edu | careers@fitchburgstate.edu | studentdev@fitchburgstate.edu
"Medium (10,000–19,999)",12000,Brockport State University of New York,8,"School of Business & Management | Department of Accounting, Economics & Finance | Academic Affairs | Career Services | Student Leadership & Activities",business@brockport.edu | aef@brockport.edu | provost@brockport.edu | careers@brockport.edu | getinvolved@brockport.edu
"Medium (10,000–19,999)",12000,Central State University,8,"College of Business | Department of Accounting, Finance & Economics | Academic Affairs | Career Services | Student Activities",business@centralstate.edu | afe@centralstate.edu | provost@centralstate.edu | careers@centralstate.edu | studentactivities@centralstate.edu
"Medium (10,000–19,999)",12000,Tufts University,8,Tufts Real Estate Society (via Student Activities) | Urban & Environmental Policy and Planning (UEP) Department | Department of Economics | Tufts Gordon Institute | Tufts Career Center,studentactivities@tufts.edu | uep@tufts.edu | econ@tufts.edu | gordoninstitute@tufts.edu | careercenter@tufts.edu
"Medium (10,000–19,999)",12000,Worcester State University (Massachusetts),6,Department of Business Administration & Economics | Department of Urban Studies | Career Services | Employer Engagement | Office of Student Involvement,business@worcester.edu | urbanstudies@worcester.edu | careerservices@worcester.edu | employers@worcester.edu | studentinvolvement@worcester.edu
"Medium (10,000–19,999)",12000,University of Rochester,6,Department of Economics | Simon Business School | Ain Center for Entrepreneurship | Greene Center for Career Education & Connections | Employer & Alumni Engagement,economics@rochester.edu | admissions@simon.rochester.edu | aincenter@rochester.edu | career.center@rochester.edu | employerrelations@rochester.edu
"Medium (10,000–19,999)",12000,Thomas Edison State University (NJ),6,John A. Sabo | School of Business & Management | Office of the Provost | Career Services | Office of Student Engagement,jsabo@tesu.edu | sbm@tesu.edu | provost@tesu.edu | careerservices@tesu.edu | ose@tesu.edu
"Medium (10,000–19,999)",12000,Framingham State University (MA),6,"College of Business | Department of Economics, Finance & Analytics | Office of the Provost | Career Services & Employer Relations | Center for Student Experience & Career Development",business@framingham.edu | efa@framingham.edu | provost@framingham.edu | career@framingham.edu | studentlife@framingham.edu
"Medium (10,000–19,999)",12000,Westfield State University (MA),6,College of Business & Technology | Department of Economics | Office of the Provost | Career Center | Office of Student Involvement & Leadership,business@westfield.ma.edu | economics@westfield.ma.edu | provost@westfield.ma.edu | careercenter@westfield.ma.edu | osi@westfield.ma.edu
"Medium (10,000–19,999)",11000,Austin Peay State University,22,Office of Student Engagement | Student Government Association | Dr. Keith Mayo | Dr. David Murdock | Dr. Steve Golden,studentengagement@apsu.edu | sga@apsu.edu | mayok@apsu.edu | murdockdj@apsu.edu | goldensa@apsu.edu
"Medium (10,000–19,999)",11000,Central Connecticut State University,10,Real Estate Club | School of Business | Department of Finance | Dr. Shaneen M. Singh | Department of Economics,studentorgs@ccsu.edu | business@ccsu.edu | finance@ccsu.edu | singhs@ccsu.edu | economics@ccsu.edu
"Medium (10,000–19,999)",11000,Coastal Carolina University,9,"Real Estate Club (via Grant Center) | Robert Salvino, Ph.D. | Shana Pyle | Erika Engel Small, Ph.D. | Sourav Batabyal, Ph.D.",grantcenter@coastal.edu | rsalvino@coastal.edu | spyle@coastal.edu | esmall@coastal.edu | sbatabyal@coastal.edu
"Medium (10,000–19,999)",11000,College of Charleston,11,"College of Charleston Real Estate Club | Mark J. Buono, Ph.D. | Kenneth W. Soyeh, Ph.D. | Adam Swalley | Finance Department – School of Business",studentorgs@cofc.edu | buonom@cofc.edu | soyehkw@cofc.edu | swalleyad@cofc.edu | finance@cofc.edu
"Medium (10,000–19,999)",11000,Purdue University Fort Wayne,10,"Doermer School of Business | Kevin J. Fandl, Ph.D. | Department of Accounting & Finance | Department of Economics | Student Involvement & Leadership",business@pfw.edu | fandlk@pfw.edu | accounting@pfw.edu | economics@pfw.edu | studentengagement@pfw.edu
"Medium (10,000–19,999)",11000,Valdosta State University,9,Harley Langdale Jr. College of Business Admin Office | Department of Economics & Finance Office | Student Activities Office | Belk College Student Org Support | Career Opportunities & Volunteer Services,business@valdosta.edu | econfin@valdosta.edu | studentactivities@valdosta.edu | studentactivities@valdosta.edu | careerops@valdosta.edu
"Medium (10,000–19,999)",11000,Villanova University,10,Villanova School of Business | Department of Finance | Department of Economics | Villanova Real Estate Club (official routing) | Student Involvement Office,vsb@villanova.edu | finance@villanova.edu | economics@villanova.edu | studentorgs@villanova.edu | studentorgs@villanova.edu
"Medium (10,000–19,999)",11000,William Paterson University,9,"Cotsakos College of Business Office | Department of Accounting, Finance & Economics | Real Estate Society (via Student Activities) | Dr. Sandra Suarez | Career Development Center",business@wpunj.edu | finance@wpunj.edu | studentactivities@wpunj.edu | suarezs@wpunj.edu | careers@wpunj.edu
"Medium (10,000–19,999)",11000,Bellevue University,8,Career Services | College of Business | Workforce & Employer Partnerships | Student Engagement Office | Academic Affairs Office,career@bellevue.edu | cob@bellevue.edu | employerrelations@bellevue.edu | studentengagement@bellevue.edu | academicaffairs@bellevue.edu
"Medium (10,000–19,999)",11000,Regent University,8,"College of Business & Leadership – Dean’s Office | Department of Accounting, Finance & Economics | Center for Entrepreneurship | Student Activities | Career Services",cbl@regent.edu | accounting@regent.edu | entrepreneurship@regent.edu | studentactivities@regent.edu | career@regent.edu
"Medium (10,000–19,999)",11000,University of Arkansas at Little Rock,5,College of Business | Dr. Jane Wayland | Department of Finance | Career Services | Admissions Office,business@ualr.edu | jmwayland@ualr.edu | finance@ualr.edu | careerservices@ualr.edu | admissions@ualr.edu
"Medium (10,000–19,999)",11000,Villanova University – Online,6,Patrick G. Maggitti | vbs@villanova.edu | realestate@villanova.edu | careers@villanova.edu | employerrelations@villanova.edu,patrick.maggitti@villanova.edu | vbs@villanova.edu | realestate@villanova.edu | careers@villanova.edu | employerrelations@villanova.edu
"Medium (10,000–19,999)",11000,University of Minnesota Duluth,8,Labovitz School of Business & Economics | Economics Department | Center for Economic Development | Career & Internship Services | Student Life,lsbe@d.umn.edu | econ@d.umn.edu | ced@d.umn.edu | careers@d.umn.edu | studentlife@d.umn.edu
"Medium (10,000–19,999)",11000,Mitchell College,8,School of Business | Business Administration Program | Academic Affairs | Career Services | Student Life,business@mitchell.edu | businessadmin@mitchell.edu | provost@mitchell.edu | careers@mitchell.edu | studentlife@mitchell.edu
"Medium (10,000–19,999)",11000,Massachusetts Institute of Technology (MIT),8,MIT Center for Real Estate | Department of Urban Studies and Planning | MIT Sloan Career Development Office | MIT Real Estate Club (via Sloan CDO) | MIT Career Advising & Professional Development,cre-info@mit.edu | duspinfo@mit.edu | askcdo@mit.edu | askcdo@mit.edu | capd@mit.edu
"Medium (10,000–19,999)",10000,Azusa Pacific University,11,Real Estate Society | School of Business & Management Student Organizations | Dr. David Summers | Dr. Brian Stoner | Dr. John R. McKnight,studentlife@apu.edu | sbm@apu.edu | dsummers@apu.edu | bstoner@apu.edu | jmcknight@apu.edu
"Medium (10,000–19,999)",10000,"California State University, Bakersfield",12,"Dr. Di Wu, CPA, CMA | Dr. Mahdy Elhusseiny | Dr. John Emery | Dr. Mingwei Liang | Dr. Dan Zhou",dwu2@csub.edu | melhusseiny@csub.edu | jemery@csub.edu | mliang4@csub.edu | dzhou@csub.edu
"Medium (10,000–19,999)",10000,"California State University, Stanislaus",10,Real Estate Club | College of Business Administration | Department of Finance | Department of Economics | College of Business Administration,studentinvolvement@csustan.edu | business@csustan.edu | finance@csustan.edu | economics@csustan.edu | business@csustan.edu
"Medium (10,000–19,999)",10000,Chapman University,16,"Alexander E. Hayden School of Real Estate Office | Fadel Lawandy | Mitchell Warachka, Ph.D. | Joel Kotkin | Chapman Real Estate Association (CREA) routing via Business Student Orgs Office",realestate@chapman.edu | lawandy@chapman.edu | warachka@chapman.edu | kotkin@chapman.edu | busstudentorgs@chapman.edu
"Medium (10,000–19,999)",10000,Duquesne University,10,"Real Estate & Land Development Association (RELDA) | Palumbo-Donahue School of Business Office | George Saridakis, PhD | John S. Hoenig, DBA | Economics & Finance Department Office",osa@duq.edu | palumboschool@duq.edu | saridakis@duq.edu | hoenigj@duq.edu | econfin@duq.edu
"Medium (10,000–19,999)",10000,Hofstra University,17,Hofstra Real Estate Association (via Student Organizations) | Frank G. Zarb School of Business Office | Department of Finance | Department of Economics | Center for Career Design & Development,studentorganizations@hofstra.edu | business@hofstra.edu | finance@hofstra.edu | economics@hofstra.edu | careerdesign@hofstra.edu
"Medium (10,000–19,999)",10000,Howard University,11,Howard University Real Estate Development Program | Center for Real Estate Education & Development | School of Business – Dean’s Office | Department of Finance & International Business | Department of Economics,cred@howard.edu | cred@howard.edu | hsb@howard.edu | finance@howard.edu | economics@howard.edu
"Medium (10,000–19,999)",10000,Indiana University of Pennsylvania,10,Office of Student Leadership & Involvement | Eberly College of Business | Department of Finance | Department of Economics | Department of Management,getinvolved@iup.edu | eberly-college@iup.edu | finance-dept@iup.edu | economics@iup.edu | management@iup.edu
"Medium (10,000–19,999)",10000,Loyola Marymount University,10,LMU Real Estate Society (via Student Organizations) | College of Business Administration Office | Department of Finance | Department of Economics | Center for Urban Resilience (urban development–adjacent),getinvolved@lmu.edu | cba@lmu.edu | finance@lmu.edu | economics@lmu.edu | urbanresilience@lmu.edu
"Medium (10,000–19,999)",10000,Morehead State University,8,"College of Business & Technology | Department of Accounting, Finance & Economics | Small Business Development Center (SBDC) | Career Services | Center for Career Development & Experiential Education",cbt@moreheadstate.edu | accounting@moreheadstate.edu | sbdc@moreheadstate.edu | careers@moreheadstate.edu | careerdevelopment@moreheadstate.edu
"Medium (10,000–19,999)",10000,Murray State University,8,Arthur J. Bauernfeind College of Business | Department of Economics & Finance | Small Business Development Center (SBDC) | Career Services | Center for Student Involvement,business@murraystate.edu | economics@murraystate.edu | sbdc@murraystate.edu | career.services@murraystate.edu | student.involvement@murraystate.edu
"Medium (10,000–19,999)",10000,Sacred Heart University,10,Sacred Heart University Real Estate Club | Jack Welch College of Business & Technology | Peter Grose | Finance Department | Economics Department,realestate@sacredheart.edu | welchcollege@sacredheart.edu | grosep@sacredheart.edu | finance@sacredheart.edu | economics@sacredheart.edu
"Medium (10,000–19,999)",10000,Seton Hall University,10,Stillman School of Business | Joyce E. Strawser | Department of Finance | Department of Economics | Student Activities,stillman@shu.edu | joyce.strawser@shu.edu | finance@shu.edu | economics@shu.edu | studentactivities@shu.edu
"Medium (10,000–19,999)",10000,Southern Connecticut State University,10,School of Business | Michael S. McGuirk | Department of Economics & Finance | Economics Program | Office of Student Involvement & Leadership,business@southernct.edu | mcguirkm1@southernct.edu | econfinance@southernct.edu | economics@southernct.edu | studentinvolvement@southernct.edu
"Medium (10,000–19,999)",10000,University of Alabama in Huntsville,7,"College of Business Administration – Dean’s Office | Department of Finance, Economics & Accounting | Neal M. Sharpe, Ph.D. | Career Services Office | Charger Union – Student Activities",cob@uah.edu | fea@uah.edu | neal.sharpe@uah.edu | career@uah.edu | studentactivities@uah.edu
"Medium (10,000–19,999)",10000,University of Central Arkansas,10,"College of Business – Dean’s Office | Department of Accounting & Finance | Department of Economics, Finance & Insurance | UCA Real Estate Club (official routing via Student Organizations) | Center for Insurance & Risk Management",business@uca.edu | acctfin@uca.edu | efi@uca.edu | studentorganizations@uca.edu | cirm@uca.edu
"Medium (10,000–19,999)",10000,University of Northern Iowa,20,Wilson College of Business | Department of Finance | Department of Economics | Wilson Undergraduate Programs Office | Student Involvement Center,business@uni.edu | finance@uni.edu | economics@uni.edu | business@uni.edu | involvement@uni.edu
"Medium (10,000–19,999)",10000,University of San Francisco,10,USF Real Estate Association (REA) | School of Management – Dean’s Office | Department of Finance – Main Office | Department of Economics – Main Office | School of Management Career Services,studentengagement@usfca.edu | som@usfca.edu | finance@usfca.edu | economics@usfca.edu | somcareers@usfca.edu
"Medium (10,000–19,999)",10000,University of South Dakota,10,Office of Student Involvement | Beacom School of Business – Main Office | Beacom School of Business – Dean’s Office | Department of Economics | Department of Finance,getinvolved@usd.edu | business@usd.edu | business@usd.edu | economics@usd.edu | finance@usd.edu
"Medium (10,000–19,999)",10000,University of Southern Indiana,7,Romain College of Business – Dean’s Office | Accounting & Finance Department Chair | Finance Faculty Contact | Student Life Office | Career Success Center,bocoll@usi.edu | tnoland@usi.edu | tnoland@usi.edu | student.life@usi.edu | career.center@usi.edu
"Medium (10,000–19,999)",10000,Youngstown State University,14,"Williamson College of Business Administration Office | Department of Finance, Accounting & Economics | Real Estate–related Student Orgs (via Student Activities) | Career Center | Employer Relations Team",wcba@ysu.edu | finance@ysu.edu | activities@ysu.edu | career@ysu.edu | career@ysu.edu
"Medium (10,000–19,999)",10000,Colorado Mesa University,8,Davis School of Business Office | Department of Economics | Career Services | Employer Partnerships | Student Engagement & Leadership,business@coloradomesa.edu | economics@coloradomesa.edu | careerservices@coloradomesa.edu | employerrelations@coloradomesa.edu | studentengagement@coloradomesa.edu
"Medium (10,000–19,999)",10000,Indiana University of Pennsylvania – Online,9,IUP Online | Graduate Admissions | Eberly College of Business | Department of Finance | Career and Professional Development Center,iup-online@iup.edu | grad-admissions@iup.edu | business@iup.edu | finance@iup.edu | career-center@iup.edu
"Small-Medium (5,000–9,999)",9000,Belmont University,12,Belmont Real Estate Society | College of Business Student Organizations | Dr. Christopher J. Edmonds | Dr. Kevin Duncan | Dr. Shad Morris,studentactivities@belmont.edu | business@belmont.edu | christopher.edmonds@belmont.edu | kevin.duncan@belmont.edu | shad.morris@belmont.edu
"Small-Medium (5,000–9,999)",9000,College of William & Mary,6,Todd A. Mooradian | Raymond A. Mason School of Business | Christopher Kummer | Graduate Career Management Center | Office of Career Development & Professional Engagement,dean@mason.wm.edu | mba@mason.wm.edu | christopher.kummer@mason.wm.edu | mbacareers@mason.wm.edu | career@wm.edu
"Small-Medium (5,000–9,999)",9000,Creighton University,10,"Craig W. Dallon, JD | Lee M. Dunham, Ph.D. | Robert R. Johnson, Ph.D., CFA, CAIA | Melissa Woodley, Ph.D., CFA | John P. Fahey Career Center (Main)",CraigDallon@creighton.edu | LeeDunham@creighton.edu | RobertJohnson@creighton.edu | MelissaWoodley@creighton.edu | careercenter@creighton.edu
"Small-Medium (5,000–9,999)",9000,Florida A&M University,6,"Office of Student Activities | Dr. R. Cherie Archer | Dr. John R. Allen | Department of Accounting, Finance & Information Systems | Office of Student Activities",studentactivities@famu.edu | cherie.archer@famu.edu | john.allen@famu.edu | afis@famu.edu | studentactivities@famu.edu
"Small-Medium (5,000–9,999)",9000,Jacksonville State University,10,"Office of Student Activities & Organizations | College of Commerce and Business Administration | Dr. Deborah Murray | Department of Finance, Economics & Accounting | Department of Management & Marketing",studentlife@jsu.edu | ccba@jsu.edu | dmurray@jsu.edu | finance@jsu.edu | management@jsu.edu
"Small-Medium (5,000–9,999)",9000,Long Island University,6,Ray Pullaro | College of Business | Gregory H. Buehler | Career Services | Employer Relations,ray.pullaro@liu.edu | business@liu.edu | gregory.buehler@liu.edu | career@liu.edu | employers@liu.edu
"Small-Medium (5,000–9,999)",9000,Northwestern State University of Louisiana,7,Business School Admin (School of Business) | Dr. Mark Swanstrom | College of Business & Technology | Career Center | Student Affairs – Dr. Yonna Pasch,joanna.thompson@nsula.edu | mark.swanstrom@nsula.edu | cobt@nsula.edu | careercenter@nsula.edu | paschy@nsula.edu
